{"protocol":"study6.bridge.v2","sessionId":"session-001","bridgeProcessEpoch":"apk-process-example","browserPageEpoch":"browser-page-example","transportEpoch":"browser-transport-example","revision":1,"messageId":"web-record-for-1","expectedRevision":1,"deadlineElapsedRealtimeMs":999999999,"sender":{"role":"webxr","instanceId":"browser-page-example"},"target":"apk","type":"command","payload":{"action":"record_for","sessionId":"session-001","webxrRevision":8,"jobId":"ecg-attempt-001","artifactStem":"ecg_PH1_HC_HE_b1_attempt001","durationMs":10000}}
