{"protocol":"study6.bridge.v2","sessionId":"session-001","bridgeProcessEpoch":"apk-process-example","browserPageEpoch":"browser-page-example","transportEpoch":"browser-transport-example","revision":0,"messageId":"web-begin-1","expectedRevision":0,"deadlineElapsedRealtimeMs":999999999,"sender":{"role":"webxr","instanceId":"browser-page-example"},"target":"apk","type":"command","payload":{"action":"begin_recording","sessionId":"session-001","webxrRevision":7,"recordingRequestId":"recording-request-001"}}
