{"protocol":"study6.bridge.v2","sessionId":"session-001","bridgeProcessEpoch":"apk-process-example","browserPageEpoch":"browser-page-example","transportEpoch":"browser-transport-example","revision":0,"messageId":"web-marker-1","expectedRevision":0,"deadlineElapsedRealtimeMs":999999999,"sender":{"role":"webxr","instanceId":"browser-page-example"},"target":"apk","type":"command","payload":{"action":"record_experiment_marker","marker":{"markerId":"session-001-media-started-1","eventType":"media_started","webxrRevision":8,"sessionId":"session-001","blockOrder":1,"conditionId":"HC_HE","mediaId":"Hand_HC_HE","mediaPositionMs":0,"browserMonotonicMs":12000,"browserUtc":"2026-08-30T12:00:00Z"}}}
