{"protocol":"study6.bridge.v2","bridgeProcessEpoch":"apk-process-example","transportEpoch":"browser-transport-example","revision":0,"messageId":"apk-message-1","sender":{"role":"apk","instanceId":"apk-process-example"},"target":"webxr","type":"hello","payload":{"schemaRevision":2,"buildId":"sensor-bridge-0.4.0","capabilities":["polar_h10_ecg","durable_ecg","durable_markers","sensor_export","staged_receipts","begin_recording","session_owned_recording","polar_status_projection","single_webxr_owner","bridge_launch_nonce","recording_jobs","timed_recording_jobs","recording_job_pause_resume","recording_artifact_verification"],"authority":"sensor_recorder_provider"}}
