{"protocol":"study6.bridge.v2","bridgeProcessEpoch":"apk-process-example","browserPageEpoch":"browser-page-example","transportEpoch":"browser-transport-example","revision":0,"messageId":"apk-message-3","sender":{"role":"apk","instanceId":"apk-process-example"},"target":"webxr","type":"polar_status","payload":{"phase":"streaming","ready":true,"readinessReason":"ready","heartRateBpm":68,"rrIntervalMs":882,"rrIntervalCount":1,"ecgSampleRateHz":130,"ecgSampleCount":390,"lastSampleAgeMs":10,"stableDurationMs":3000,"previewKind":"real_samples","waveformMicrovolts":[-12,4,19],"writer":{"phase":"recording","healthy":true,"queueDepth":0,"storageFreeBytes":1000000},"reconnectCount":0,"gapCount":0}}
