{"protocol":"study6.bridge.v2","bridgeProcessEpoch":"apk-process-example","browserPageEpoch":"browser-page-example","transportEpoch":"browser-transport-example","revision":0,"messageId":"apk-message-2","sender":{"role":"apk","instanceId":"apk-process-example"},"target":"webxr","type":"snapshot","payload":{"recording":{"recordingEpoch":"apk-process-example-recording-1","ownerSessionId":null,"state":"recording","revision":0,"markerCount":0,"samplesWritten":0,"droppedBatches":0,"artifactOpen":true,"durable":true,"job":{"state":"idle","jobId":null,"artifactStem":null,"requestedDurationMs":null,"activeDurationMs":0,"samplesWritten":0,"droppedBatches":0,"artifactComplete":false,"durable":true}},"polar":{"phase":"scanning","ready":false,"readinessReason":"sensor-not-connected","heartRateBpm":null,"rrIntervalMs":null,"rrIntervalCount":0,"ecgSampleRateHz":null,"ecgSampleCount":0,"lastSampleAgeMs":null,"stableDurationMs":null,"previewKind":"none","waveformMicrovolts":[],"writer":{"phase":"recording","healthy":true,"queueDepth":0,"storageFreeBytes":1000000},"reconnectCount":0,"gapCount":0}}}
