{"protocol":"study6.bridge.v2","sessionId":"session-001","bridgeProcessEpoch":"apk-process-example","browserPageEpoch":"browser-page-example","transportEpoch":"browser-transport-example","revision":2,"messageId":"web-verify-recording-1","expectedRevision":2,"deadlineElapsedRealtimeMs":999999999,"sender":{"role":"webxr","instanceId":"browser-page-example"},"target":"apk","type":"command","payload":{"action":"verify_recording_artifact","sessionId":"session-001","webxrRevision":9,"jobId":"ecg-attempt-001","artifactStem":"ecg_PH1_HC_HE_b1_attempt001"}}
