{"protocol":"study6.bridge.v2","bridgeProcessEpoch":"unbound","browserPageEpoch":"browser-page-example","transportEpoch":"browser-transport-example","revision":0,"messageId":"webxr-message-1","sender":{"role":"webxr","instanceId":"browser-page-example"},"target":"apk","type":"hello","payload":{"schemaRevision":2,"buildId":"webxr-placeholder-rehearsal","capabilities":["webxr_experiment_authority","polar_status_projection","experiment_metadata_markers","begin_recording","recording_jobs","timed_recording_jobs","recording_job_pause_resume","recording_artifact_verification"],"authority":"webxr_experiment_owner","bridgeLaunch":"bridgeLaunchExample12345"}}
